{"agent_id":"AGT-CODER","version":"1.0.0","role":"CODER","model_binding_ref":"MODEL-CODING-1","prompt_template_ref":{"id":"PRM-CODER","version":"1.0.0","content_hash":"sha256:aaaaaaaaaaaaaaaaaaaaaaaaaaaaaaaaaaaaaaaaaaaaaaaaaaaaaaaaaaaaaaaa"},"skill_refs":[{"id":"factory-coding","version":"1.0.0","content_hash":"sha256:cccccccccccccccccccccccccccccccccccccccccccccccccccccccccccccccc"}],"capability_tags":["typescript"],"content_hash":"sha256:bbbbbbbbbbbbbbbbbbbbbbbbbbbbbbbbbbbbbbbbbbbbbbbbbbbbbbbbbbbbbbbb","status":"DRAFT","created_at":"2026-08-05T12:00:00Z"}
